abstract,author,n_cited,n_reference,paper,title,year
"We present a theoretical analysis of the lateral displacement (Goos-Hanchen shift) of spatially limited beams reflected from attenuated total reflection (ATR) devices in the Otto configuration when backward surface plasmon polaritons are excited at the interface between a positive refractive index slab and a semi-infinite metamaterial with a negative refractive index. First, the stationary phase approximation and a phenomenological model based on the properties of the complex poles and zeroes of the reflection coefficient are used to demonstrate that: (i) the excitation of backward surface waves can lead to both negative and positive (and not exclusively negative) Goos-Hanchen shifts, and (ii) the sign of the shift depends on whether the value of the coupling layer thickness is higher or lower than a critical value characteristic of the ATR structure. Then, these findings are verified through rigorous calculations of the spatial structure of the reflected beam. For incident beams with a Gaussian profile, the lateral shift calculated as the first moment of the field distribution of the reflected beam agrees quite well with the predictions of approximate analysis. Near the resonant excitation of the backward surface plasmon polariton, large (negative or positive) Goos-Hanchen shifts are obtained, along with a splitting of the reflected beam.","Zeller, MA; Cuevas, M; Depine, RA",2,31,JOURNAL OF OPTICS,Critical coupling layer thickness for positive or negative Goos-Hanchen shifts near the excitation of backward surface polaritons in Otto-ATR systems,2015
"Controlling of the Goos-Hanchen (GH) shifts of the reflected and transmitted probe pulses through a cavity containing four-level GaAs/AlGaAs quantum dot with 15 periods of 17.5 nm GaAs wells and 25-nm Al0.3Ga0.7As barriers is investigated. Under appropriate conditions, the probe absorption can be converted to the probe gain, therefore, the controlling of negative and positive GH shift in the both reflected and transmitted probe beams can be occurred simultaneously. Our obtained results show that the group index of the probe beams could be negative or positive in both reflected and transmitted pulses. Therefore, simultaneous subluminal or superluminal light propagation in reflected and transmitted pulses can be achieved.","Asadpour, SH; Nasehi, R; Mahmoudi, M; Soleimani, HR",5,54,JETP LETTERS,Controlling of Goos-Hanchen shift via biexciton coherence in a quantum dot,2015
"We have explored the zero, positive and negative quantum Goos-Hanchen (GH) shifts of the transmitted Dirac carriers in graphene through a potential barrier with vertical magnetic field. Numerical results show that only one energy position at the zero GH shift exists and is highly dependent on the y-directional wave vector, the energy gap, the magnetic field and the potential. The positive and negative GH shifts happen when the incident energy is more and less than the energy position at the zero GH shift, respectively. In addition, we found that there are two values of potential at the zero GH shifts, where a potential window can always keep the positive GH shifts. These results may be useful in designing a graphene-based valley or spin splitter as well as manipulating the electrons and holes in graphene nanostructure. (C) 2014 Elsevier B.V. All rights reserved.","Jellal, A; Wang, YH; Zahidi, Y; Mekkaoui, M",4,26,PHYSICA E-LOW-DIMENSIONAL SYSTEMS & NANOSTRUCTURES,"Zero, positive and negative quantum Goos-Hanchen shifts in graphene barrier with vertical magnetic field",2015
"The Goos-Hanchen shift of the system composed by two cavity walls and an intracavity atomic sample is presented. The atomic sample is treated as a four-level double-Lambda system, driven by the two counterpropagating coupling fields. The probe field experiences the discontinuous refractive index variation and is reflected. Moreover, under the phase-matching condition, the four-wave mixing effect based on electromagnetically induced transparency can cause effective reflection. The Goos-Hanchen shifts appear in both situations and are carefully investigated in this article. We refer to the first one with the incident and reflected light having identical wavelength as the linear Goos-Hanchen shift, and the second one with the reflection wavelength determined by the phase-matching condition as the nonlinear Goos-Hanchen shift. The differences between the two kinds of shifts, such as the incident angle range, conditions for the shift peaks, and controllability, are discussed.","Zhang, XJ; Wang, HH; Liang, ZP; Xu, Y; Fan, CB; Liu, CZ; Gao, JY",4,51,PHYSICAL REVIEW A,Goos-Hanchen shift in a standing-wave-coupled electromagnetically-induced-transparency medium,2015
"We consider a matter wave packet of cold atom gas impinging upon a step potential created by an optical light field. In the presence of spin-orbit coupling, the atomic eigenstates contain two types of evanescent states, one of which is an ordinary evanescent state with a pure imaginary wave vector while the other possesses a complex wave vector and is recognized as an oscillating evanescent state. We show that the presence and interplay of these two types of evanescent states can give rise to two different mechanisms for total internal reflection, and thus lead to an unusual Goos-Hanchen (GH) effect. As a result, not only large positive but also large negative GH shifts can be observed in the reflected atomic beam. The dependence of the GH shift on the incident angle, energy, and height of the step potential is studied numerically.","Zhou, L; Qin, JL; Lan, ZH; Dong, GJ; Zhang, WP",3,27,PHYSICAL REVIEW A,Goos-Hanchen shifts in spin-orbit-coupled cold atoms,2015
"In this Letter, we report a phenomenon of large in-plane-photonic-spin-splitting (IPPSS) in the case of a linear polarized Gaussian light beam reflected from an air-glass interface at the Brewster angle. The IPPSS-induced displacement reaches similar to 12.4 mu m, which is quite larger than the previously reported value. Particularly, the IPPSS is extremely sensitive (similar to 70 mu m/deg) to the incident polarization. We also find that the direction of the spin accumulation can be switched by adjusting the incident polarization slightly. These findings may have useful applications in spin manipulation and precise polarization metrology. (C) 2015 Optical Society of America","Qiu, XD; Zhang, ZY; Xie, LG; Qiu, JD; Gao, FH; Du, JL",15,21,OPTICS LETTERS,Incident-polarization-sensitive and large in-plane-photonic-spin-splitting at the Brewster angle,2015
"We present a design of a one dimensional dielectric waveguide that can trap a broadband light pulse with different frequency component stored at different positions, effectively forming a ""trapped rainbow"" [Nature 450, 397 (2007)]. The spectrum of the rainbow covers the whole visible range. To do this, we first show that the dispersion of a SiO2 waveguide with a Si grating placed on top can be engineered by the design parameter of the grating. Specifically, guided modes with zero group velocity(frozen modes) can be realized. Negative Goos-Hanchen shift along the surface of the grating is responsible for such a dispersion control. The frequency of the frozen mode is tuned by changing the lateral feature parameters (period and duty cycle) of the grating. By tuning the grating feature point by point along the waveguide, a light pulse can be trapped with different frequency components frozen at different positions, so that a ""rainbow"" is formed. The device is expected to have extremely low ohmic loss because only dielectric materials are used. A planar geometry also promises much reduced fabrication difficulty. (C) 2015 Optical Society of America","Yang, R; Zhu, WK; Li, JJ",5,15,OPTICS EXPRESS,"Realization of ""trapped rainbow"" in 1D slab waveguide with surface dispersion engineering",2015
"Light reflection and refraction at an interface between two homogeneous media is analytically described by Snell's law. For a beam with a finite waist, it turns out that the reflected wave experiences a lateral displacement from its position predicted by geometric optics. Such Goos-Hanchen (G-H) effect has been extensively investigated among all kinds of optical media, such as dielectrics, metals, photonic crystals and metamaterials. As a fundamental physics phenomenon, the G-H effect has been extended to acoustics and quantum mechanics. Here we report the unusual G-H effect in zero index metamaterials. We show that when linearly polarized light is obliquely incident from air to epsilon-near-zero metamaterials, no G-H effect could be observed for p polarized light. While for s polarization, the G-H shift is a constant value for any incident angle.","Xu, YD; Chan, CT; Chen, HY",16,31,SCIENTIFIC REPORTS,Goos-Hanchen effect in epsilon-near-zero metamaterials,2015
"The electromagnetic interaction of atoms with an evanescent light field is investigated with photon energy density and photon energy flux density using the Fresnel-Maxwell equations. The theory provides expressions of absorption signal intensities in attenuated total reflection spectroscopy for the p- and s-polarizations of the incident light, and relates them to the Goos-Hanchen shift. For an electric dipole interaction, the energy stored in the electric field of an evanescent light governs the absorption process, and hence the photon energy density and the photon energy flux density should be estimated from the energy stored in the electric field. The violation of equality between the portions of the energy stored respectively in the electric and magnetic fields yields the difference of the absorption signal intensity and its dependence on the incident angle between the s- and p-polarizations. (C) 2015 The Japan Society of Applied Physics","Muroo, K",0,13,JAPANESE JOURNAL OF APPLIED PHYSICS,Electromagnetic interaction of atoms with an evanescent light field in attenuated total reflection spectroscopy,2015
"The interference between optical beams of different polarizations plays a fundamental role in reproducing the optical analog of the electron spin weak measurement. The extraordinary point in optical weak measurements is represented by the possibility of estimating with great accuracy the Goos-Hanchen (GH) shift by measuring the distance between the peaks of the outgoing beams for two opposite rotation angles of the polarizers located before and after the dielectric block. Starting from the numerical calculation of the GH shift, which clearly shows a frequency crossover for incidence near the critical angle, we present a detailed study of the interference between s and p polarized waves in the critical region. This makes it possible to determine in which conditions axial deformations can be avoided and the GH curves reproduced. In view of a possible experimental implementation, we give the expected weak measurement curves for Gaussian lasers of different beam waist sizes propagating through borosilicate (BK7) and fused silica dielectric blocks.","Araujo, MP; De Leo, S; Maia, GG",4,37,JOURNAL OF OPTICS,Axial dependence of optical weak measurements in the critical region,2015
"We use the stationary phase method to determine the paths of optical beams that propagate through a dielectric block. In the presence of partial internal reflection, we recover the geometrical result obtained by using Snell's law. For total internal reflection, the stationary phase method overreaches Snell's law, predicting the Goos-Hanchen shift. (C) 2015 American Association of Physics Teachers.","Carvalho, SA; De Leo, S",4,37,AMERICAN JOURNAL OF PHYSICS,The use of the stationary phase method as a mathematical tool to determine the path of optical beams,2015
"We address the nonlinear Goos-Hanchen shift of Helmholtz solitons at a nonlocal nonlinear interface between a Kerr medium and a nonlocal nonlinear medium. Based on the framework of the Helmholtz theory, we have demonstrated that the Goos-Hanchen shift depends on the angle of the incidence, the linear and nonlinear refractive index mismatch at the interface, the nonparaxial parameter and the degree of nonlocality. Interestingly, internal and external refraction can be introduced when the nonlinear refractive index mismatch is greater than a threshold value. The total reflection will occur when the degree of nonlocality exceeds a value.","Shi, ZW; Xue, J; Chen, JL; Li, Y; Li, HG",1,37,EUROPEAN PHYSICAL JOURNAL D,Goos-Hanchen shifts of Helmholtz solitons at nonlocal nonlinear interfaces,2015
"We present a theoretical analysis for the Goos-Hanchen and Imbert-Fedorov shifts experienced by an X-wave upon reflection from a dielectric interface. We show that the temporal chirp, as well as the bandwidth of the X-wave, directly affect the spatial shifts in a way that can be experimentally observed, while the angular shifts do not depend on the spectral features of the X-wave. A dependence of the spatial shifts on the spatial structure of the X-wave is also discussed. (C) 2015 Optical Society of America","Ornigotti, M; Aiello, A; Conti, C",7,40,OPTICS LETTERS,Goos-Hanchen and Imbert-Fedorov shifts for paraxial X-waves,2015
"The electronic structure of a single-layer graphene with a periodic Fermi velocity modulation is investigated by using an effective Dirac-like Hamiltonian. In a gapless graphene or in a graphene with a constant energy gap the modulation of the Fermi velocity, as expected, only changes the dispersion between energy and moment, turning the minibands narrower or less narrow than in the usual graphene depending on how the Fermi velocity is modulated and the energy gap remains the same. However, with a modulated energy gap it is possible to control the energy gap of graphene by Fermi velocity engineering. This is based on a very simple idea that has never been reported so far. The results obtained here reveal a new way of controlling the energy gap of graphene, which can be used in the fabrication of graphene-based devices. (C) 2014 Elsevier B.V. All rights reserved.","Lima, JRF",11,35,PHYSICS LETTERS A,Controlling the energy gap of graphene by Fermi velocity engineering,2015
"This is a review on theoretical and experimental studies on dielectric microcavities, which play a significant role in fundamental and applied research. The basic concepts and theories are introduced. Experimental techniques for fabrication of microcavities and optical characterization are described. Starting from undeformed cavities, the review moves on to weak deformation, intermediate deformation with mixed phase space, and then strong deformation with full ray chaos. Non-Hermitian physics such as avoided resonance crossings and exceptional points are covered along with various dynamical tunneling phenomena. Some specific topics such as unidirectional output, beam shifts, wavelength-scale microcavities, and rotating microcavities are discussed. The open microdisk and microsphere cavities are ideal model systems for the studies on wave chaos and non-Hermitian physics.","Cao, H; Wiersig, J",112,462,REVIEWS OF MODERN PHYSICS,Dielectric microcavities: Model systems for wave chaos and non-Hermitian physics,2015
"The negative and positive Goos-Hanchen (GH) shifts in reflected light are revisited for a partial coherent light incident on a cavity. A three-level dilute gaseous atomic medium, which follows two-photon Raman transitions, is considered in a cavity. The anomalous (negative group index) and normal (positive group index) dispersions of the intracavity medium lead to negative and positive GH shifts, respectively. The effects of beam width, spatial coherence, and mode index of partial coherent light fields are studied on the negative and positive GH shifts. It is observed that the amplitude of negative and positive GH shifts are relatively large for a small range of beam width and for a small value of spatial coherence of partial coherent light beams. The amplitude of GH shifts becomes small for large beam width and spatial coherence of incident light. Further, the distortion in the reflected light field increases when the amplitude of the GH shifts increases and vice versa.","Ziauddin; Chuang, YL; Lee, RK",5,33,PHYSICAL REVIEW A,Negative and positive Goos-Hanchen shifts of partially coherent light fields,2015
"First time a theoretical approach towards the enhancement of spatial and angular Goos-Hanchen (GH) shift and Imbert-Fedorov (IF) shift for a Gaussian beam and Laguerre-Gaussian beam are observed, designed and simulated in four layer Kretschmann-Raether geometry at a free space wavelength of 1550 nm. Here the proposed configuration comprises a ZnSe prism and a liquid crystal layer of E44 between two silver layers through which spatial and angular GH shift and IF shift can be observed for Gaussian beam as well as Laguerre-Gaussian beam whereas the exact output beam position can only be accurately identified with the composite effect of spatial and angular GH shift and IF shift. Here with the variation of incident angle from 400 to 500, the spatial and angular GH shift and IF shift have been calculated for two types of beams. This idea expedites the concept of optical tuning at mu m ranges and reveals the exact output beam position for every experiments with different beams.","Swain, PK; Goswami, N; Saha, A",0,19,"2015 INTERNATIONAL CONFERENCE ON MICROWAVE, OPTICAL AND COMMUNICATION ENGINEERING (ICMOCE)",Enhanced lateral shifts with Gaussian beam and Laguerre-Gaussian beam in presence of surface plasmon resonance,2015
"The time delay, space shift and widening of wave packet transmitted and reflected by structures with Bragg mirrors have been investigated. The specific structures such as Bragg mirrors, resonators, and structures with chirp variation of thickness of the ""period"" have been considered. The calculation has been carried out under the conditions that carrier frequency and incidence angle is in the vicinity of the Bragg resonance values. Integral (mass center) and differential (group) estimates of the delay time and space shift have been compared. The conditions for the appearance of anomalous (negative) mass center delay or mass center shift (Goos-Henchen shift) of the reflected wave packet have been determined. The shape transformations of the wave packet illuminating periodic and quasiperiodic apodized Bragg reflectors have been under consideration. Spatial apodization of permittivity contrast yields much smaller shape deformation of the transmitted wave packet upon incidence at angles and carrier frequency near the edges of reflection band, as well in Bragg reflection band, in comparison with phenomena in similar periodic structures. The values of group delay for layered structures with a small chirp variation of optical (electrical) thickness of the period along longitudinal coordinates have been experimentally obtained in microwave range.","Andreev, MV; Borulko, VF; Drobakhin, OO; Sidorov, DV",0,25,2015 IEEE 35TH INTERNATIONAL CONFERENCE ON ELECTRONICS AND NANOTECHNOLOGY (ELNANO),Scattering of Wave Beams and Pulses by Non-periodic Bragg Nanostructures,2015
"A high-sensitivity optical relative humidity (RH) sensor based on the enhanced Goos-Hanchen (GH) shift in a polyimide-coated symmetrical metal cladding waveguide is proposed. The interaction between the diffused water molecules and the polyimide film can lead to a combined change in the thickness and the refractive index, which will give rise to a dramatic change of GH shift. Our optical RH sensor can provide a good linearity and a short response time.","Wang, XP; Yuan, W; Sang, MH",0,6,2015 OPTO-ELECTRONICS AND COMMUNICATIONS CONFERENCE (OECC),An Optical Relative Humidity Sensor Based on the Enhanced Goos-Hanchen Shift,2015
"Close to the magnon resonance frequency, antiferromagnets act as indefinite permeability media, i.e., not all their permeability tensor components are of the same sign. This behavior can induce a series of optical effects such as all-angle negative refraction. In the presence of an external field, a non-reciprocal lateral shift on reflection is also possible. We illustrate these effects using the example of MnF2. In this crystal both the angle of refraction and the Goos-Hanchen shift become tunable when an external magnetic field is applied.","Macedo, R; Dumelow, T; Stamps, RL",0,8,9TH INTERNATIONAL CONGRESS ON ADVANCED ELECTROMAGNETIC MATERIALS IN MICROWAVES AND OPTICS (METAMATERIALS 2015),Tunable Magneto-Optical Effects in Antiferromagnetic Structures,2015
A vacuum layer over the surface of local metallic nanoparticles (MNP) is used to reproduce the effect of nonlocality in the Goos-Hanchen(GH) shift of reflected light from a composite material of metallic nanoparticles. The thickness of the vacuum layer for reproduced nonlocal GH shift is tuned accurately compared to the GH shift of the Maxwell-Garnett nonlocal effective medium,"Huang, JH",0,10,2015 IEEE MTT-S INTERNATIONAL MICROWAVE WORKSHOP SERIES ON RF AND WIRELESS TECHNOLOGIES FOR BIOMEDICAL AND HEALTHCARE APPLICATIONS (IMWS-BIO),Nonlocal optical effects on the Goos-Hanchen shift at an interface of a composite material of metallic nanoparticles-A simple model approach,2015
"The surface plasmon enhanced optical amplification is proposed, designed and simulated in Kretschmann geometry formed by a 500 pm thick, 10 mm long and 5 mm wide BK7 parallel slab and 29 nm thin gold layer which is sandwiched between the said parallel slab and 20 nm thin GaAs layer. This GaAs layer is pumped by 1319 rim higher order Gaussian beam of a Nd:YAG laser, which passes through a cylindrical lens thereby generating a high aspect ratio elliptical cross section to attain intensity dependent negative extinction coefficient on that 3 mm long strip of irradiated GaAs. The negative extinction coefficient of GaAs layer facilitates the amplification of the incident optical radiation at 1550 nm within the communication window. Here the incident pulsed optical radiation of 5 mW is amplified to 274 MW through external pumping and surface plasmon resonance phenomenon by total internal reflection with three bounces along the length of said BK7 parallel slab considering the Goos-Hanchen shift at the slab-Au layer interface and slab-air interface. (C) 2015 Elsevier GmbH. All rights reserved.","Goswami, N; Saha, A; Ghosh, A",0,32,OPTIK,Optical amplification using surface plasmon resonance with total internal reflection,2015
"We study the large Goos-Hanchen (GH) shift for different guided mode in the metal insulator metal waveguide by the adjusting of electro-optic (EO) material permittivity. Stationary-phase method is used to calculate the GH shifts for different guided mode propagating in the waveguide, and simulation results show that the increase of the upper-cladding metal layer reduces the GH shift and the critical incident angle. In addition, the GH shift of higher-order mode has less sensitivity to the change of thickness of upper-cladding metal layer but better sensitivity to the incident angle than lower-order mode. These different properties of GH shift for different modes can be used to design detectors with different functions. (C) 2015 Elsevier GmbH. All rights reserved.","Tang, TT",0,6,OPTIK,Large Goos-Hanchen shift for different modes in metal-insulator-metal waveguide with electro-optic material,2015
"Both positive and negative lateral shifts are demonstrated in this paper for a Gaussian beam reflected from an anisotropic grounded slab, whose constructive parameters are determined by the optical transformation approach. The incident wave is modeled as a tapered wave with a spatial Gaussian shape. Layered structures with alternating isotropic materials are applied to model the parameters of such an anisotropic grounded slab and good agreements are obtained when the positive lateral shifts caused by ideal anisotropic slab are compared with those of the equivalent isotropic layered slab. (C) 2015 Elsevier GmbH. All rights reserved.","Wang, SY; Liu, XY",0,41,OPTIK,Arbitrary positive and negative lateral shift of Gaussian beam reflected from an anisotropic grounded slab,2015
"We developed an analytical model of a quasi-phase matched mid-infrared frequency converter which uses total internal reflection in an isotropic semi-conductor slab (GaAs) having tapered configuration. A computer-aided simulation has been performed by adopting Difference Frequency Generation (DFG) with ppp polarisation where the pump wave is of 4 mu m and the signal bandwidth lies between 14 and 17 mu m. The resultant 3 dB broadband output has a bandwidth of 523 nm centred at 15.423 mu m and a peak conversion efficiency of 0.091% in a 30 mm long slab. Due consideration has been given to the effect of optical beam walk-off on the frequency conversion process, and the losses due to absorption, Goos-Hanchen shift and surface roughness. We also analyse the impacts of the variations in tapering angle, temperature, angle of the front face, beam walk-off tolerance and angle of refraction at the air - crystal interface inside the slab, on the performance of the frequency converter. (C) 2015 Elsevier GmbH. All rights reserved.","Raj, R; Kumar, N; Kumar, S; Deb, S; Saha, A",0,30,OPTIK,Quasi-phase matched broadband difference frequency generation in the mid-infrared region using total internal reflection in a tapered gallium arsenide (GaAs) slab,2015
