abstract,author,n_cited,n_reference,paper,title,year
"We investigate how the orbital angular momentum of a paraxial light beam is affected upon reflection at a planar interface. Theoretically, the unavoidable angular spread of the beam leads to orbital angular momentum sidebands, which are found to be already significant for a modest beam spread (0.05). In analogy to the polarization Fresnel coefficients, we develop an analytical theory based upon spatial Fresnel coefficients; this allows a straightforward prediction of the strength of the sidebands. We confirm this by experiment and numerical simulation.","Loffler, W; Aiello, A; Woerdman, JP",18,25,PHYSICAL REVIEW LETTERS,Observation of Orbital Angular Momentum Sidebands due to Optical Reflection,2012
"A prism-coupled metal-dielectric-metal waveguide structure is presented to detect slight variations in wavelength. Strong spatial dispersion ability is exhibited at the guided-mode resonance, which leads to a rapid changing of the reflected beam shift with respect to the light wavelength. It is demonstrated to be an effective way to enlarge the lateral shift of the reflected beam by increasing the guiding layer thickness, which helps to improve the sensitivity of the wavelength-shift monitoring. A wavelength resolution as high as 0.027 pm is achieved in the experiment. (C) 2012 American Institute of Physics. [http://dx.doi.org/10.1063/1.4740258]","Wang, Y; Jiang, XG; Li, Q; Wang, Y; Cao, ZQ",6,22,APPLIED PHYSICS LETTERS,High-resolution monitoring of wavelength shifts utilizing strong spatial dispersion of guided modes,2012
"For total reflection of a pulsed light beam at the interface between vacuum and a negative permittivity medium, the electromagnetic fields and the associated energy-flux patterns in the two media are investigated analytically and numerically. For a TE (transverse electric) polarized pulsed beam with positive Goos-Hanchen shift, energy reflection occurs not only in the second medium but also in the first medium because of interference between the incident and reflected fields. However, for TM (transverse magnetic) polarization where the Goos-Hanchen shift is negative, reflection of energy flux occurs in the first medium (or in front of the interface). At the same time, the energy flux around the interface forms time-dependent loops which absorb energy from the incoming flux in the front edge of the pulse but release energy into the outgoing flux in the later edge of the pulse to ensure energy conservation. Therefore, the so-called causality paradox in TM polarization is caused by the fact that interference between incident and reflected fields in the first medium and energy-flux loops around the interface offer a shorter path for reflection of energy flux (or photons).","Liu, XM; Yang, QF; Zhu, PF; Zhang, YL; Shi, Y",0,32,JOURNAL OF OPTICS,The time-dependent energy-flux pattern in total reflection of a pulsed light beam,2012
"We investigate the Goos-Hanchen (GH) effect of spin electron beams in a magnetic-barrier (MB) nanostructure consisting of antiparallel double delta-MBs, which can be experimentally realized by depositing two ferromagnetic (FM) stripes on top and bottom of the semiconductor heterostructure. GH shifts for spin electron beams across this type of MB nanostructures, is derived exactly, with the help of the stationary phase method. It is shown that GH shifts depend strongly on the spin directions for double delta-MBs with unidentical magnetic strengths, giving rise to a considerable spin polarization effect. It also is shown that spin polarization of GH shifts is closely relative to the separation and magnetic-strength difference of two delta-MBs. These interesting properties may provide an alternative scheme to spin-polarize electrons into the semiconductor, and the devices can serve as tunable spin beam splitters. (C) 2012 Elsevier By. All rights reserved.","Kong, YH; Lu, MW; Chen, SY; Zhang, GL",14,23,JOURNAL OF MAGNETISM AND MAGNETIC MATERIALS,Lateral shifts of spin electron beams in antiparallel double delta-magnetic-barrier nanostructure,2012
"A possibility to observe huge lateral shift (Goos-Hanchen effect) of exchange spin wave reflected from the interface of two ferromagnetic materials is theoretically investigated. The strong dependence of this effect on the exchange coupling between two magnetic media as well as on the magnetic field is obtained. We show that nonzero interlayer exchange is necessary to observe the lateral shift of reflected spin-wave, and this shift can reach values up to a few hundreds of wavelengths. The observed effect can be a useful tool in investigation of the magnetic coupling between two magnetic materials also through nonmagnetic spacer. (C) 2012 American Institute of Physics. [http://dx.doi.org/10.1063/1.4738987]","Dadoenkova, YS; Dadoenkova, NN; Lyubchanskii, IL; Sokolovskyy, ML; Klos, JW; Romero-Vivas, J; Krawczyk, M",16,30,APPLIED PHYSICS LETTERS,Huge Goos-Hanchen effect for spin waves: A promising tool for study magnetic properties at interfaces,2012
"The simple reflection of a light beam of finite transverse extent from a homogeneous interface gives rise to a surprisingly large number of subtle shifts and deflections which can be seen as diffractive corrections to the laws of geometrical optics (Goos-Hanchen shifts) and manifestations of optical spin-orbit coupling (Imbert-Fedorov shifts), related to the spin Hall effect of light. We develop a unified linear algebra approach to dielectric reflection which allows for a simple calculation of all these effects and lends itself to an interpretation of beam shifts as weak values in a classical analogue to a quantum weak measurement. We present a systematic study of the shifts for the whole beam and its polarization components, finding symmetries between input and output polarizations and predicting the existence of material independent shifts.","Gotte, JB; Dennis, MR",40,28,NEW JOURNAL OF PHYSICS,Generalized shifts and weak values for polarization components of reflected light beams,2012
"We describe how the notion of optical beam shifts (including the spatial and angular Goos-Hanchen shift and Imbert-Federov shift) can be understood as a classical analogue of a quantum measurement of the polarization state of a paraxial beam by its transverse amplitude distribution. Under this scheme, complex quantum weak values are interpreted as spatial and angular shifts of polarized scalar components of the reflected beam. This connection leads us to predict an extra spatial shift for beams with a radially-varying phase dependance.","Dennis, MR; Gotte, JB",53,40,NEW JOURNAL OF PHYSICS,The analogy between optical beam shifts and quantum weak measurements,2012
"We reveal a large spin angular splitting of light beam on reflection at the Brewster angle both theoretically and experimentally. A simple weak measurements system manifesting itself for the built-in post-selection technique is proposed to explore this angular splitting. Remarkably, the directions of the spin accumulations can be switched by adjusting the initial handedness of polarization. (C) 2012 Optical Society of America","Zhou, XX; Luo, HL; Wen, SC",12,19,OPTICS EXPRESS,Weak measurements of a large spin angular splitting of light beam on reflection at the Brewster angle,2012
"The manipulation of the Goos-Hanchen shifts in the reflected and transmitted light beam through a cavity containing four-level atomic medium is investigated by modifying the dispersion-absorption properties of the intracavity medium. Via two external coherent control fields, the Goos-Flanchen shifts of the reflected and transmitted beam can be easily controlled. It is found that around the transparent region of the medium, the Goos-Hanchen shifts are very sensitive and can be enhanced as compared with strong absorption and amplification.","Su, JN; Deng, WW; Li, GX",0,23,ACTA PHYSICA SINICA,Coherent control of the Goos-Hanchen shift in four-level atomic medium,2012
"With the help of stationary phase method, we investigate the Goos-Hanchen (GH) effect of electrons in nanostructures consisting of realistic magnetic barriers (MB) created by lithographic patterning of ferromagnetic (FM) or superconducting films. Due to intrinsic symmetry, only nanostructures with symmetric magnetic field possess a considerable spin-dependent GH effect, and GH shifts of transmitted spin beams are found to depend upon the incident angle and the incident energy of electrons as well as the size and position of the FM stripe. These interesting properties may provide an effective scheme to realize spin injection into semiconductor and also give rise to a type of spin beam splitters based on MB nanostructures. (C) 2012 American Institute of Physics. [http://dx.doi.org/10.1063/1.4730784]","Lu, MW; Zhang, GL; Chen, SY",18,32,JOURNAL OF APPLIED PHYSICS,Spin-electron beam splitters based on magnetic barrier nanostructures,2012
"We study the lateral Goos-Hanchen and the transverse Imbert-Fedorov shift produced during the reflection of Hermite-Gauss beams H-m0 or H-0m at a plane interface. The vector angular spectrum method for a light beam in terms of a two-form angular spectrum consisting of the two orthogonal polarized components was used. We have carried out a detailed numerical calculation of these shifts at different angles of incidence, over the whole range of incidence without making the usual approximations. The shift variation as a function of refractive index and order of the Hermite-Gauss beam is studied. We also compare the shift variations with the orientation of the lobes of the Hermite-Gauss beam. We observed that the shifts are nearly equal for the two cases H-m0 (lobe oriented in the plane of incidence) and H-0m (lobe oriented perpendicular to plane of incidence). These are the first quantitative estimates of the shifts for Hermite-Gauss beams as per our knowledge and are relevant for all cases of slab geometry. (C) 2012 Optical Society of America","Prajapati, C; Ranganathan, D",12,30,JOURNAL OF THE OPTICAL SOCIETY OF AMERICA A-OPTICS IMAGE SCIENCE AND VISION,Goos-Hanchen and Imbert-Fedorov shifts for Hermite-Gauss beams,2012
"
Goos-Hanchen (GH) shift of a transverse-magnetic (TM) wave reflected from a semi-infinite anisotropic metamaterial consisting of aligned metallic nanowires in a dielectric matrix is investigated. Based on Bruggeman effective medium theory, we obtain the conditions for realizing the negative refraction, which are dependent on both the incident wavelength and the volume fraction of metallic inclusions. Then, we investigate the GH shifts from the composite metamaterial with positive and negative refractions with the stationary-phase method. Numerical results show that the enhancement of GH shift can be achieved near the pseudo-Brewster angle for small volume fractions and at the close-to-grazing incidence for large volume fractions. We further find that for positively refractive metamaterials with weak absorption, one can realize the transition from negative GH shift to the positive one by adjusting the incident wavelength. However, for negatively refractive composite metamaterials, the reversal of the GH shifts may take place by the adjustment of the volume fraction instead of the incident wavelength. In order to demonstrate the validity of the stationary-phase approach, numerical simulations are performed for a Gaussian-shaped beam. In the end, by using COMSOL simulation, a comprehensive understanding is given and the above analysis is confirmed. (C) 2012 Optical Society of America","Huang, YY; Zhao, B; Gao, L",13,33,JOURNAL OF THE OPTICAL SOCIETY OF AMERICA A-OPTICS IMAGE SCIENCE AND VISION,Goos-Hanchen shift of the reflected wave through an anisotropic metamaterial containing metal/dielectric nanocomposites,2012
"In this article, we review definition, origin, terminology, fundamental properties, design concepts and procedures, basic applications, modeling, and numerical simulation of metamaterials. It is shown that metamaterial origin can be easily understood by placing metamaterials in the more general context of artificial electromagnetic materials and of the efforts performed by the scientific community working in complex materials to mimic and overcome the properties of natural materials. The basic properties of some classes of metamaterials as well as the related limitations are reviewed and discussed. A new application-oriented definition of metamaterials is given in terms of a functionalizing layer placed in between the traditional concepts of materials and devices. Metamaterial applications and the design steps of metamaterial-based and metamaterial-inspired components are also discussed, with particular emphasis on the numerical simulation of ideal metamaterials through available solvers. In this frame, finite-difference time-domain (FDTD) modeling and simulation of the electromagnetic properties of metamaterials are deeply discussed. The recently introduced virtual MTM-FDTD tool is used to simulate the interaction between the electromagnetic field and metamaterials and show some metamaterial effects, such as beam focusing, existence of negative refractive angle, and so forth, through various examples in different scenarios. (c) 2012 Wiley Periodicals, Inc. Int J RF and Microwave CAE 22:422438, 2012.","Bilotti, F; Sevgi, L",35,128,INTERNATIONAL JOURNAL OF RF AND MICROWAVE COMPUTER-AIDED ENGINEERING,"Metamaterials: Definitions, properties, applications, and FDTD-based modeling and simulation (Invited paper)",2012
"We report giant Goos-Hanchen shifts [Goos and Hanchen, Ann. Phys. 436, 333 (1947)] for electron beams tunneling through graphene double barrier structures. We find that inside the transmission gap for the single barrier, the shift displays sharp peaks with magnitudes up to the order of electron beam width and rather small full-widths-at-half-maximum, which may be utilized to design valley and spin beam splitters with wide tunability and high energy resolution. We attribute the giant shifts to quasibound states in the structures. Moreover, an induced energy gap in the dispersion can increase the tunability and resolution of the splitters. (C) 2012 American Institute of Physics. [http://dx.doi.org/10.1063/1.4730440]","Song, Y; Wu, HC; Guo, Y",30,35,APPLIED PHYSICS LETTERS,Giant Goos-Hanchen shift in graphene double-barrier structures,2012
"Reflection and refraction of a finite-power Airy beam at the interface between two dielectric media are investigated analytically and numerically. The formulation takes into account the paraxial nature of the optical beams to derive convenient field evolution equations in coordinate frames moving along Snell's refraction and reflection axes. Through numerical simulations, the self-accelerating dynamics of the Airy-like refracted and reflected beams are observed. Of special interest are the cases of critical incidence at Brewster and total-internal-reflection (TIR) angles. In the former case, we find that the reflected beam achieves self-healing, despite the severe suppression of a part of its spectrum, while, in the latter case, the beam remains nearly unaffected except for the Goos-Hanchen shift. The self-accelerating quality persists even if the beam is trapped by multiple TIRs inside a dielectric film. The grazing incidence of an Airy beam at the interface between two media with close refractive indices is also investigated, revealing that the interface can act as a filter depending on the beam scale and tilt. We finally consider reverse refraction and perfect imaging of an Airy beam into a left-handed medium. (c) 2012 Optical Society of America","Chremmos, ID; Efremidis, NK",13,30,JOURNAL OF THE OPTICAL SOCIETY OF AMERICA A-OPTICS IMAGE SCIENCE AND VISION,Reflection and refraction of an Airy beam at a dielectric interface,2012
"We present a solution to the problem of reflection and refraction of a polarized Gaussian beam at the interface between the transparent medium and the moving object based on Minkowski's constitutive relations. The Goos-Hanchen (GH) and Imbert-Fedorov (IF) effects are discussed in detail when the object moves parallel to the interface. It is shown that the IF shifts of reflection and transmission beams can reach several wavelengths of the incident beam at some certain incident angles and moving velocities of the object. The transitions from the positive IF shift to the negative IF shift have been observed with the increase of the velocity of the moving object. Further-more, our calculations show that some unusual GH effects can also be caused by the movement of the medium. The physical origins for these phenomena have been analyzed. It is well known that the IF shift is directly related to the spin-Hall effects of light. Thus, these findings can also provide an alternative pathway for controlling the spin-Hall effects of light. (C) 2012 Optical Society of America","Wang, HL; Zhang, XD",3,28,JOURNAL OF THE OPTICAL SOCIETY OF AMERICA B-OPTICAL PHYSICS,Goos-Hanchen and Imbert-Fedorov shifts of an electromagnetic wave packet by a moving object,2012
"We demonstrate a dual-beam-reflection phenomenon for a Gaussian beam illuminating at a Kretschmann configuration composed of a photonic-crystal-made prism and a dielectric waveguide. One reflection beam has a positive shift and the other has a negative shift. The finite-difference time-domain (FDTD) shows that the specific phenomenon takes place only when the corresponding quasi-guided mode supported in the Kretschmann configuration is excited. Field profile of the quasi-guided mode demonstrates a strong localized stationary field in the dielectric waveguide. We found that the maximum positive lateral shift (LS) is 14.27a (where a is the lattice constant), corresponding to 3.07 times of the incident wavelength, which is 0.7135 times of the beam waist and much larger than that in some previous reports. (C) 2012 Published by Elsevier B.V.","Zhou, F; Han, K; Ge, Y; Ju, FL; Shen, YF; Tang, G",1,19,OPTICS COMMUNICATIONS,Non-specular reflection of self-collimated beams in photonic-crystal-made prism and waveguide system,2012
"Control of Goos-Hanchen (GH) shift in reflected and transmitted light is revisited for a Gaussian light incident on a cavity. The intracavity atomic medium follows duplicated two-level atomic configurations where two fields, i.e., a strong control field and a relatively weak probe field are employed [F. A. Hashmi and M. A. Bouchene, Phys. Rev. Lett. 101, 213601 (2008)]. The coherent control is achieved via phase shift phi between control and probe fields. The effect of incident light width on negative or positive GH shifts and distortion in the reflected and transmitted light is investigated.","Ziauddin; Qamar, S",21,30,PHYSICAL REVIEW A,Control of the Goos-Hanchen shift using a duplicated two-level atomic medium,2012
"In this paper, we present a systematic study of beam shifts and angular momenta of paraxial vortex beams at air-left-handed-material (LHM) interfaces. It is shown that, compared to their counterparts at air-right-handed-material (RHM) interfaces, the spatial Goos-Hanchen (GH) and Imbert-Fedorov (IF) shifts remain the same, while the angular GH and IF shifts are reversed at air-LHM interfaces. The spatial and angular shifts of paraxial vortex beams have their respective origins in transverse angular momenta and transverse linear momenta. The spatial GH and IF shifts remain unreversed as a result of both reversions of transverse angular momenta and z-component linear momentum, while the angular GH and IF shifts are reversed because the z-component linear momentum is reversed and the transverse linear momenta are unreversed at air-LHM interfaces. In addition, we perform a quantitative analysis on spin-orbit angular momentum conversion and orbit-orbit angular momentum conversion, which further helps us understand the essence of vortex beam shifts at air-LHM interfaces and their fundamental distinctions from those at air-RHM interfaces.","Xiao, ZC; Luo, HL; Wen, SC",8,61,PHYSICAL REVIEW A,Goos-Hanchen and Imbert-Fedorov shifts of vortex beams at air-left-handed-material interfaces,2012
"The manipulation of the Goos-Hanchen (GH) shifts of the reflected and transmitted probe beams through a cavity containing Delta-configuration artificial or realistic atomic medium is investigated. Adjusting the coherent control fields of atomic medium, the electromagnetically induced transparency with amplification (EITA) can be yielded. When the frequency of probe beam is around EITA, the negative as well as positive GH shifts of the reflected and transmitted probe beams can be greatly enhanced by EITA. Meantime, the GH shift can be switched between the considerably large positive and negative values by adjusting the collective phase of the external fields. (C) 2012 Elsevier B.V. All rights reserved.","Deng, WW; Wu, SP; Li, GX",11,41,OPTICS COMMUNICATIONS,Enhancement of the Goos-Hanchen shift by electromagnetically induced transparency with amplification,2012
"Correlated to the quantum mechanics wave-particle duality, the optical analogy between electromagnetic waves and cold neutrons manifests itself through several interference phenomena particularly the so called Frustrated Total Reflection i.e., the tunneling process in Fabry-Perot nano-structured cavities. Prominent resonant situations offered by this configuration allow the attainment of numerous fundamental investigations and surface-interface studies as well as to devise new kinds of neutron optics devices. This review contribution reports such possibilities in addition to the recently observed peculiar Goos-Hanchen longitudinal shift of neutron wave-particles which was predicted by Sir Isaac Newton as early as 1730. (C) 2012 Elsevier B.V. All rights reserved.","Maaza, M; Hamidi, D",3,96,PHYSICS REPORTS-REVIEW SECTION OF PHYSICS LETTERS,Nano-structured Fabry-Perot resonators in neutron optics & tunneling of neutron wave-particles,2012
"The partial derivative equations of Zoeppritz equations are established and the derivatives of each matrix entry with respect to wave vectors are derived in this paper. By solving the partial derivative equations we obtained the partial derivatives of seismic wave reflection coefficients with respect to wave vectors, and computed the Goos-Hanchen shift for reflected P- and VS-waves. By plotting the curves of Goos-Hanchen shift, we gained some new insight into the lateral shift of seismic reflection wave. The lateral shifts are very large for glancing wave or the wave of the incidence angle near the critical angle, meaning that the seismic wave propagates a long distance along the reflection interface before returning to the first medium. For the reflection waves of incidence angles away from the critical angle, the lateral shift is in the same order of magnitude as the wavelength. The lateral shift varies significantly with different reflection interfaces. For example, the reflected P-wave has a negative shift at the reflection interface between mudstone and sandstone. The reflected VS-wave has a large lateral shift at or near the critical angle. The lateral shift of the reflected VS-wave tends to be zero when the incidence angle approaches 90A degrees. These observations suggest that Goos-Hanchen effect has a great influence on the reflection wave of wide-angles. The correction for the error caused by Goos-Hanchen effect, therefore, should be made before seismic data processing, such as the depth migration and the normal-moveout correction. With the theoretical foundation established in this paper, we can further study the correction of Goos-Hanchen effect for the reflection wave of large incidence angle.","Liu, FP; Meng, XJ; Xiao, JQ; Wang, AL; Yang, CC",2,39,SCIENCE CHINA-EARTH SCIENCES,The Goos-Hanchen shift of wide-angle seismic reflection wave,2012
"Using Yasumoto and Oishi's energy flux method, a generalized analytical formulation for analyzing the Goos-Hanchen (GH) shift in frustrated total internal reflection is provided, from which the GH shift given by Artman's stationary phase method is shown to equal the GH calculated by Renard's conventional energy flux method plus a self-interference shift. The self-interference shift, originating from the interference between the incident and reflected beams, sheds light on the asymptotic behavior of the GH shift in such optical tunneling process in term of energy flux. (C) 2012 Optical Society of America","Chen, X; Lu, XJ; Zhao, PL; Zhu, QB",8,18,OPTICS LETTERS,Energy flux and Goos-Hanchen shift in frustrated total internal reflection,2012
"We show that the phase velocity in a stationary state of a de Broglie wave can be directly obtained from the probability distribution, i.e. the quantum trajectories, without detailed knowledge of the phase term itself. In other words, the amplitude of a de Broglie wave function describes not only the probability distribution but also the phase velocity distribution. Using this relationship, we comment on two calculations of the Goos-Hanchen shift in de Broglie waves.","Wang, PX; Wang, JX; Huo, YK; Scheid, W; Hora, H",3,35,CHINESE SCIENCE BULLETIN,Relating the probability distribution of a de Broglie wave to its phase velocity,2012
