abstract,author,n_cited,n_reference,paper,title,year
"We report a theoretical investigation on Goose-Hanchen (GH) effect for spin electrons across a magnetically confined GaAs/AlxGa1-xAs microstructure modulated by spin-orbit coupling [(SOC), including Rashba and Dresselhaus types]. An intrinsic symmetry in the device is broken by SOC, which gives rise to a considerable spin polarization effect in GH shifts of electrons. Both magnitude and direction of spin polarization can be manipulated by Rashba or Dresselhaus SOC, i.e., interfacial confining electric field or strain engineering. Based on such a semiconductor microstructure, a controllable spatial spin splitter can be proposed for spintronics applications.","Lu, MW; Chen, SY; Huang, XH; Zhang, GL",0,36,IEEE JOURNAL OF THE ELECTRON DEVICES SOCIETY,Spin Splitter Based on Magnetically Confined Semiconductor Microstructure Modulated by Spin-Orbit Coupling,2018
"We observed positive and negative Goos-Hanchen (GH) shifts in plasmon-induced transparency (PIT) in a metal-insulator-metal (MIM) multi-layer structure based on the attenuated total reflection response. Here, the MIM waveguide (WG) mode and the surface plasmon polariton (SPP) resonance act as low-and high-Q resonances, respectively. SPP also induced the transparency window in otherwise opaque wavenumber (k) regions. The observed GH shifts were caused by the relevant k-domain dispersion in PIT, which is controllable through the adjustment of the coupling strength between the MIM WG and SPP resonances. This effect, thus, can be recognized as a rigorous counterpart of slow light in electromagnetically induced transparency and other related phenomena in the frequency domain. The tunable GH shift in PIT in a MIM structure would enable applications in beam steering devices and high-sensitivity sensors. Published by AIP Publishing.","Hirai, Y; Matsunaga, K; Neo, Y; Matsumoto, T; Tomita, M",0,39,APPLIED PHYSICS LETTERS,Observation of Goos-Hanchen shift in plasmon-induced transparency,2018
"We study the influence of the thermo-optic effect and of thermal expansion on the lateral shift experienced by a Gaussian near-infrared beam upon reflection from a voltage-controlled nematic liquid crystal cell deposited on a magnetic yttrium-iron garnet film. Variations of temperature are considered in the range between room temperature and the nematic-isotropic phase transition temperature of the liquid crystal and induce changes in both the layer thicknesses and the permittivity tensor components of the constituents. We show that for all polarization configurations of the incoming and reflected beams, these changes modify the amplitude of the extrema of the lateral beam shift and their position with respect to the incidence angle of the beam and, except in the s-s polarization configuration, to the voltage applied to the liquid crystal cell. In the p-p and p-s polarization configurations, this drift can thus be controlled at some incidence angles by tuning the applied voltage. Moreover, in the p-s configuration, the lateral shift can be also controlled by a magnetization reversal in the magnetic layer. Finally, we discuss the possibility of temperature monitoring using the temperature dependence of the lateral shift in this system. Published by AIP Publishing.","Dadoenkova, YS; Bentivegna, FFL; Petrov, RV; Bichurin, MI",0,41,JOURNAL OF APPLIED PHYSICS,Thermal dependence of the lateral shift of a light beam reflected from a liquid crystal cell deposited on a magnetic film,2018
"The characteristics of an incident Gaussian monochromatic light beam at sharp critical angle are investigated and analyzed. The numerical results are obtained using fast Fourier transform based beam propagation method (FFT-BPM). In this study, we adapt the FFT-transverse electric (TE) polarizations. The field properties in the denser and rare medium are carefully examined. Further, the Goos-Hanchen (GH) shift is calculated based on the lateral field using the FFT-BPM at sharp critical angle which cannot be obtained by other analytical methods. Moreover, the effects of the wavelength and denser medium refractive index on the GH shift are also investigated. The calculated results are in good agreement with that introduced in the literature. Moreover, the suggested analysis could shed light on more accurate modeling techniques for the GH shift calculation and its impact on the relevant photonic applications. In this regard, the calculated GH shifts at sharp critical angle are used for monitoring glucose concentration variations in biomedical applications with high sensitivity. Additionally, we presented for the first time to the authors' knowledge- the effect of the incident field pattern such as: Lorentz-Gauss, Super-Gaussian, Super-Lorentzian, and super-Lorentz-Gauss on the GH calculations. (C) 2017 Elsevier GmbH. All rights reserved.","Shaaban, A; Hamee, MFO; Gomaa, LR; Obayya, SSA",0,54,OPTIK,Accurate calculation of Goos-Hanchen shift at critical angle for complex laser beam profiles using beam propagation method,2018
"A new scheme focusing on modification and control of distortion in the reflection and transmission of Goos-Hanchen (GH) shifted beams, is discussed. The absorptivity, reflectivity, and transmissivity are measured for the new atomic scheme. The GH-shifted beam is modified by control fields and incident angle. The sum of absorption, transmission, and reflection coefficients is equal to one. For positive reflection GH-shift region, there is negative transmission GH shift. The distortion in the reflected and transmitted beam is controlled with incident angle and control fields. The results discussed in this article show significant applications in micro-optics and nano-optics, acoustics, and plasma physics.","Khan, H; Haneef, M",0,27,CANADIAN JOURNAL OF PHYSICS,Distortion management of the Goos-Hanchen shifts in reflection-transmission beams,2018
"In this paper, we discuss the transmission properties of weak probe laser field propagate through slab cavity with defect layer of carbon-nanotube quantum dot (CNT-QD) nanostructure. We show that due to spin-orbit coupling, the double electromagnetically induced transparency (EIT) windows appear and the giant Kerr nonlinearity of the intracavity medium can lead to manipulating of transmission coefficient of weak probe light. The thickness effect of defect layer medium has also been analyzed on transmission properties of probe laser field. Our proposed model may be useful for integrated photonics devices based on CNT-QD for applications in all-optical systems which require multiple EIT effect.","Solookinejad, G; Jabbari, M; Sangachin, EA; Asadpour, SH",0,48,INTERNATIONAL JOURNAL OF THEORETICAL PHYSICS,Theoretical Investigation of Light Transmission in a Slab Cavity via Kerr Nonlinearity of Carbon Nanotube Quantum Dot Nanostructure,2018
"We demonstrated tailored plasmon-induced transparency (PIT) in a metal (Au)-insulator (SiO2)-metal (Ag) (MIM) structure, where the Fano interference between the MIM waveguide mode and the surface plasmon polariton (SPP) resonance mode induced a transparency window in an otherwise opaque wavenumber (k) region. A series of structures with different thicknesses of the Ag layer were prepared and the attenuated total reflection (ATR) response was examined. The height and width of the transparency window, as well as the relevant k-domain dispersion, were controlled by adjusting the Ag layer thickness. To confirm the dependency of PIT on Ag layer thickness, we performed numerical calculations to determine the electric field amplitude inside the layers. The steep k-domain dispersion in the transparency window is capable of creating a lateral beam shift known as the Goos-Hanchen shift, for optical device and sensor applications. We also discuss the Fano interference profiles in a omega - k two-dimensional domain on the basis of Akaike information criteria.","Matsunaga, K; Hirai, Y; Neo, Y; Matsumoto, T; Tomita, M",1,42,SCIENTIFIC REPORTS,Tailored plasmon-induced transparency in attenuated total reflection response in a metal-insulator-metal structure,2017
"A proposal on high-resolution electro-optical beam steering is conceptualized analytically using a long-range surface plasmon resonance configuration comprising a liquid crystal layer of E44 for 1550 nm wavelength. With the tuning of the refractive index of E44 through variations of applied voltage from 0 to 10 V, an optical beam steering can be attained considering the composite effect of spatial and angular Goos - Hanchen and Imbert Fedorov shifts. As compared with the existing beam shift processes in mu rad by mechanical means, here, the computed angular resolution is 3.40 nrad. The proposed idea finds a new avenue in the field of pulse generation, optical sensor applications, and atomic force microscopy, mitigating existing drawbacks. (C) 2017 Optical Society of America","Kar, A; Goswami, N; Saha, A",0,45,APPLIED OPTICS,Analysis of high-resolution electro-optical beam steering by long-range surface plasmon resonance using a ZnSe prism,2017
"We propose a method of realizing an effective beam splitter for Dirac-Weyl fermions through the Goos-Hanchen-like shift. It is implemented via the birefringence of a wave packet of pseudospin-3/2 Dirac-Weyl fermions impinging upon a potential barrier. It is shown that experimentally observable spatial separation between the transmitted fermions with helicity-1 /2 and 3/2 can be generated by the Goos-Hanchen-like shift. The dependence of Goos-Hanchen-like shift and the corresponding transmission probability on the incident angle, the height and width of the potential barrier are carefully studied. (C) 2017 Elsevier B.V. All rights reserved.","Zheng, RF; Zhou, L; Zhang, WP",0,37,PHYSICS LETTERS A,A beam splitter for Dirac-Weyl fermions through the Goos-Hanchen-like shift,2017
"The spin splitting of light beams carrying orbital angular momentum (OAM) is investigated theoretically in attenuated internal reflection in the Kretschmann configuration. The excitation of the surface plasmon resonance (SPR) can significantly enhance the OAM-induced Imbert-Fedorov (IF) shift and the OAM-dependent spin splitting. The cooperation effect of these two shifts will result in an asymmetric spin splitting, which varies with the incident angle and polarization state. Specially, at the SPR angle, the OAMinduced IF shift vanishes, and the OAM-dependent spin splitting will cause a symmetric spin splitting. However, when the incident beam is horizontally polarized, the OAMinduced IF shift predominates. Thus the two spin components of the reflected will not be split; instead, they will be shifted together. This flexible control of the optical spin splitting can find applications in quantum information and precision metrology. (C) 2017 Optical Society of America","Zhu, WG; Zhuo, LQ; Jiang, MJ; Guan, HY; Yu, JH; Lu, HH; Luo, YH; Zhang, J; Chen, Z",0,27,OPTICS LETTERS,Controllable symmetric and asymmetric spin splitting of Laguerre-Gaussian beams assisted by surface plasmon resonance,2017
"The geometric phase visualization proposed by Bhandari (R Bhandari 1997 Phys. Rep. 281 1-64) in the ellipticity-ellipse orientation basis of the polarization ellipse of light is implemented to understand the geometric aspects of weak measurement. The weak interaction of a pre-selected state, acheived via spin-Hall effect of light (SHEL), results in a spread in the polarization ellipticity (eta) or ellipse orientation (chi) depending on the resulting spatial or angular shift, respectively. The post-selection leads to the projection of the eta spread in the complementary chi basis results in the appearance of a geometric phase with helical phase topology in the eta - chi parameter space. By representing the weak measurement on the Poincare sphere and using Jones calculus, the complex weak value and the geometric phase topology are obtained. This deeper understanding of the weak measurement process enabled us to explore the techniques' capabilities maximally, as demonstrated via SHEL in two examples-external reflection at glass-air interface and transmission through a tilted half-wave plate.","Samlan, CT; Viswanathan, NK",0,42,JOURNAL OF OPTICS,Geometric phase topology in weak measurement,2017
"Ray optics have proven to be an effcient and versatile tool to describe dielectric optical microcavities and their far-field emission based on the principle of ray-wave correspondence. Whereas often the well-known ray-optics at planar interfaces yields reasonable results, semiclassically and boundary-curvature induced corrections will become more important as the cavity size is further reduced. In this paper, we summarize the various ray optics descriptions of optical microresonators, in addition paying special attention to the differences that arise between chaotic versus non-chaotic (integrable or nearly integrable) resonator geometries, respectively. Whereas the far-field pattern in the chaotic case is known to be determined by the overlap of the unstable manifold with the leaky region, it results from the emission of trajectories with the smallest nonzero decay rates in the non-chaotic situation. We present an enhanced ray optical description, extended by wave-inspired (semiclassical) corrections, and discuss their consequences for the ray dynamics. In particular, we find clear indications for the presence of attractors resulting from the non-Hamiltonian character of the extended ray dynamics in phase space. We illustrate their impact on the far-field emission and show that it can considerably differ from the conventional ray description result.","Stockschlaeder, P; Hentschel, M",0,41,JOURNAL OF OPTICS,Consequences of a wave-correction extended ray dynamics for integrable and chaotic optical microcavities,2017
"Dipole interaction between spins induces a nonzero Berry curvature for magnons in ferromagnetic films, and this Berry curvature gives rise to various phenomena such as thermal Hall effect. In previous works, it has been calculated for magnons with dipole interaction only. Nevertheless, magnon dispersion is largely affected by the exchange interaction neglected in the previous works. In this paper, we calculated Berry curvature of magnons in ferromagnetic films with the dipole and exchange interactions. The resulting Berry curvature shows a sign change by varying the wave number, unlike that with the dipole interaction only. Besides, we calculate the Berry curvature at the anticrossings between magnon modes, and we find that hybridization between eigenmodes at anticrossings gives rise to a large peak in the Berry curvature. In addition, we calculate a shift of the magnon wave packet at the edge of the film coming from the Berry curvature, and it is enhanced at reflection at the anticrossing.","Okamoto, A; Murakami, S",0,36,PHYSICAL REVIEW B,Berry curvature for magnons in ferromagnetic films with dipole-exchange interactions,2017
"Spin waves (SWs) are promising information carriers which can be used in modern magnonic devices, characterized by higher performance and lower energy consumption than presently used electronic circuits. However, before practical application of SWs, the efficient control over SW amplitude and phase needs to be developed. We analytically analyze reflection and refraction of the SWs at the interface between two ferromagnetic (FM) materials. In the model, we consider the system consisting of two semi-infinite FM media, separated by the ultra-narrow interface region with the magnetic anisotropy. We have found the Goos-Hanchen (GH) shift for SWs in transmission and reflection, and performed detailed investigations of its dependence on the anisotropy at the interface and materials surrounding the interface. We have demonstrated the possibility of obtaining CH shift of several wavelengths in reflection for realistic material parameters. That proves the possibility for change of the SWs phase in FM materials at sub-wavelength distances, which can be regarded as a metasurface for magnonics.","Mailyan, M; Gruszecki, P; Gorobets, O; Krawczyk, M",0,24,IEEE TRANSACTIONS ON MAGNETICS,Goos-Hanchen Shift of a Spin-Wave Beam at the Interface Between Two Ferromagnets,2017
"In this paper, we discuss the phase management of Goos-Hanchen (GH) shifts of a probe light through a cavity with a single-layer graphene nanostructure under a strong magnetic field. By using the quantum mechanical density matrix formalism we study the GH shifts of reflected and transmitted light beams. It is realized that negative or positive GH shifts can be achieved simultaneously by tuning some controllable parameters such as relative phase and the Rabi frequency of the applied fields. Moreover, the thickness effect of the cavity structure is considered as an effective parameter for adjusting the GH shifts of reflected and transmitted light beams. We find that by choosing suitable parameters, a maximum negative shift of 4.5 mm and positive shift of 5.4 mm are possible for GH shifts in reflected and transmitted light. Our proposed model may be useful for developing all-optical devices in the infrared region.","Solookinejad, G; Jabbari, M; Panahi, M; Sangachin, EA",0,44,LASER PHYSICS,Phase manipulation of Goos-Hanchen shifts in a single-layer of graphene nanostructure under strong magnetic field,2017
"In this work, we theoretically study the Goos-Hanchen effect of the reflected and transmitted light in an epsilonnear- zero (ENZ) slab. For a lossless ENZ slab, it is found that the Goos-Hanchen shifts are greatly enhanced near resonances for both TE-and TM-polarized beams, which is approximately inverse to the sufficiently small (but finite) value of permittivity. In a lossy ENZ slab, the reflected and transmitted GH shifts are different near resonances, and there are large negative GH shifts for the reflected beam and large positive shifts in the transmitted beam, and the detailed properties are discussed. There is similar behavior near the Brewster angle for TMpolarized light in both the lossy and lossless ENZ slabs. Compared with the results in the semi-infinite ENZ structure, our results may provide the richer control on the GH shifts in ENZ slabs and are potentially useful to design the ENZ-based optical devices. (C) 2017 Optical Society of America","Wen, JS; Zhang, JX; Wang, LG; Zhu, SY",0,31,JOURNAL OF THE OPTICAL SOCIETY OF AMERICA B-OPTICAL PHYSICS,Goos-Hanchen shifts in an epsilon-near-zero slab,2017
"We propose a simple method for the precise identification of graphene layers at the air-prism interface via a pseudo-Brewster angle, where the horizontally polarized reflection is close to zero. We find that the pseudo-Brewster angle is sensitive to the variation of graphene layers where the pseudo-Brewster angle is approximately linearly increased about 0.5 deg as the layer numbers increased. Furthermore, the sensitivity of the pseudo-Brewster angle can be greatly enhanced and reaches 0.04 deg by eliminating the influence of the cross-polarization effect. Our scheme can provide a simple and effective method to identify the layer numbers of graphene. (C) 2017 Optical Society of America","Mi, CQ; Chen, SZ; Wu, WJ; Zhang, WS; Zhou, XX; Ling, XH; Shu, WX; Luo, HL; Wen, SC",0,33,OPTICS LETTERS,Precise identification of graphene layers at the air-prism interface via a pseudo-Brewster angle,2017
"We theoretically predict a giant quantized Goos-Hanchen (GH) effect on the surface of graphene in the quantum Hall regime. The giant quantized GH effect manifests itself as an angular shift whose quantized step reaches the order of mrad for light beams impinging on a graphene-on-substrate system. The quantized GH effect can be attributed to quantized Hall conductivity, which corresponds to the discrete Landau levels in the quantum Hall regime. We find that the quantized step can be greatly enhanced for incident angles near the Brewster angle. Moreover, the Brewster angle is sensitive to the Hall conductivity, and therefore the quantized GH effect can be modulated by the Fermi energy and the external magnetic field. The giant quantized GH effect offers a convenient way to determine the quantized Hall conductivity and the discrete Landau levels by a direct optical measurement.","Wu, WJ; Chen, SZ; Mi, CQ; Zhang, WS; Luo, HL; Wen, SC",0,60,PHYSICAL REVIEW A,Giant quantized Goos-Hanchen effect on the surface of graphene in the quantum Hall regime,2017
"The Goos-Hanchen (GH) shift of light beam incident on graphene ribbon array is investigated by Green's function method. Due to the resonance effects of leaky surface plasmons on ribbons, the zeroth-order reflection field shows both giant positive and negative GH shifts. By tuning the graphene Fermi level, we can control the shift conveniently. This effect is important to graphene-based metasurface and electro-optical devices. (C) 2017 Optical Society of America","Zeng, XD; Al-Amri, M; Zubairy, MS",1,46,OPTICS EXPRESS,Tunable Goos-Hanchen shift from graphene ribbon array,2017
"We present a theoretical investigation of the Goos-Hanchen effect, i.e., the lateral shift of the light beam transmitted through one-dimensional biperiodic multilayered photonic systems consisting of equidistantmagnetic layers separated by finite size dielectric photonic crystals. We show that the increase of the number of periods in the photonic-magnonic structure leads to increase of the Goos-Hanchen shift in the vicinity of the frequencies of defect modes located inside the photonic band gaps. Presence of the linear magnetoelectric coupling in the magnetic layers can result in a vanishing of the positive maxima of the cross-polarized contribution to the Goos-Hanchen shift.","Dadoenkova, YS; Dadoenkova, NN; Klos, JW; Krawczyk, M; Lyubchanskii, IL",1,67,PHYSICAL REVIEW A,Goos-Hanchen effect in light transmission through biperiodic photonic-magnonic crystals,2017
"Optical beam shift is related to external conditions. Here, optical spot position and the polarization properties of the totally polarized, P-polarized, and S-polarized laser beams reflected from an aluminum film as a function of the external direct current (DC) voltage are measured by a Slit Beam Profiler and a polarimeter. The results show that the optical beam shift of the totally polarized laser beam and the S-polarized laser beam jumps from 500 to 590 mu m, and -10 to 70 mu m, respectively, at different critical pressures, when the external DC value changes from 0 to 2.5V, while the optical beam shift of the P-polarized laser beam is small and has no jump. The degree of linear polarization of different polarized laser beams cannot change, while the degree of circular polarization of different polarized laser beams changes as a function of the external DC voltage value.","Jiao, XB; Bai, X; Zhao, XW; Hao, RR; Pan, Q",0,23,PHYSICA STATUS SOLIDI A-APPLICATIONS AND MATERIALS SCIENCE,Optical beam shift induced by direct current,2017
"We propose and demonstrate the weak measurement scheme to simultaneously measure the amplified angular and spatial contributions to the Goos-Hanchen (GH) and Imbert-Fedorov (IF) shifts, due to transmission through a glass plate. We have studied two cases of post-selection using a polarizer in the first case and a quarter-wave plate (QWP)-polarizer combination in the second case. The two cases are analyzed theoretically using Jones calculus of polarization formalism and the results are verified experimentally. In the first case of post-selection, the projection of the polarizer at. +/-Delta away from the crossed position amplifies the angular GH and IF shifts, while in the second case of post-selection, the projection of QWP at +/-Delta and polarizer kept fixed measures the polarization ellipticity in the beam and thus amplifies the spatial shift along with the angular shift simultaneously, for Delta << 1.","Prajapati, C; Viswanathan, NK",0,35,JOURNAL OF OPTICS,Simultaneous weak measurement of angular and spatial Goos-Hanchen and Imbert-Fedorov shifts,2017
"We propose a method for controlling the Imbert-Fedorov(IF) shifts of a reflected beam at a graphene-coated chiral metamaterial(CMM) interface, where graphene's chemical potential, the CMM's chirality parameter and the permittivity of dielectric at interface serve as external tunable stimuli to control the IF shifts. The spatial IF(SIF) shift and angular IF(AIF) shift are formulated by the reflection coefficients. The numerical results indicate that for p-polarized incident beam, the IF shifts can be controlled efficiently near the pseudo-Brewster angle through the chemical potential, and that both the high-permittivity dielectric and low-chirality CMM can bring about a broad shift modulation. Actually, the existence of graphene reduces the SIF shifts, but it can play a crucial role in the shift modulation. The above results might be helpful in exploiting various tunable terahertz-wave devices. (C) 2017 Elsevier B.V. All rights reserved.","Xu, GD; Sun, J; Mao, HM; Pan, T",0,57,PHYSICS LETTERS A,Active control of Imbert-Fedorov shifts with graphene-coated chiral metamaterials,2017
We study and examine the Goos-Hanchen shifts of a propagating probe light field in a four-level tripodtype cold and hot atomic medium. The behavior of Goos-Hanchen shifts is studied in reflection and transmission beams in the presence of the coherent Kerr effect and the Doppler broadening effect. We observe that these shifts can be controlled by the relative propagation direction of the control field to that of the probe field.,"Iqbal, H; Idrees, M; Javed, M; Bacha, BA; Khan, S; Ullah, SA",0,33,JOURNAL OF RUSSIAN LASER RESEARCH,Goos-Hanchen Shift from Cold and Hot Atomic Media Using Kerr Nonlinearity,2017
